{"items":[{"bytesBase64URL":"eyJlbnRyaWVzIjpbeyJieXRlQ291bnQiOjMsImNvbnRlbnRUeXBlIjoiYXBwbGljYXRpb24vb2N0ZXQtc3RyZWFtIiwiZW50aXR5S2V5IjoiYXR0YWNobWVudC8wMDAwMDAwMC0wMDAwLTQwMDAtODAwMC0wMDAwMDAwMDAxMDcvYnl0ZXMiLCJvYmplY3RJZCI6IjYwYmU5ODYxNzUwZmFjYmZhZDg3NTgyNTRhMmY3NmMwY2ZlNzhkNTQ0NTlhM2JjMTg3ZDQ5YjE0MDFmY2Q4ZTgifSx7ImJ5dGVDb3VudCI6OTAsImNvbnRlbnRUeXBlIjoiYXBwbGljYXRpb24vdm5kLmZ1bWluaXdhLmVudGl0eStqc29uO3ZlcnNpb249MiIsImVudGl0eUtleSI6ImF0dGFjaG1lbnQvMDAwMDAwMDAtMDAwMC00MDAwLTgwMDAtMDAwMDAwMDAwMTA3L21ldGFkYXRhIiwib2JqZWN0SWQiOiJmYzZjZjQwNjMzMjBmYjY0NjQ5ODU1ZDBjOTgxY2E0MzA4MTJkNzVmODkwODgyYmUyZGRhNTYyZTg2NGM3Nzc5In0seyJieXRlQ291bnQiOjQ4LCJjb250ZW50VHlwZSI6ImFwcGxpY2F0aW9uL3ZuZC5mdW1pbml3YS5lbnRpdHkranNvbjt2ZXJzaW9uPTIiLCJlbnRpdHlLZXkiOiJjaGFwdGVyLzAwMDAwMDAwLTAwMDAtNDAwMC04MDAwLTAwMDAwMDAwMDEwMS9lcGlzb2RlLW9yZGVyIiwib2JqZWN0SWQiOiJhYzhmODRiMDRiNTdlMGFjNjNlMTI4NjA0YmQwNjhjYzNmNjMyYmYzZWI1M2ViZGI2Mzk3NTIxYjk5NThjN2M3In0seyJieXRlQ291bnQiOjIxLCJjb250ZW50VHlwZSI6ImFwcGxpY2F0aW9uL3ZuZC5mdW1pbml3YS5lbnRpdHkranNvbjt2ZXJzaW9uPTIiLCJlbnRpdHlLZXkiOiJjaGFwdGVyLzAwMDAwMDAwLTAwMDAtNDAwMC04MDAwLTAwMDAwMDAwMDEwMS90aXRsZSIsIm9iamVjdElkIjoiODQ2ZGU1NGY1MjY5MDZmNDM0MjNmZWFiZDNjYjdjYjg1NjRlYjg4MTgwNThmOTZlNTljMjk4MTQ2NWU0ZmUyMCJ9LHsiYnl0ZUNvdW50IjoyNzgsImNvbnRlbnRUeXBlIjoiYXBwbGljYXRpb24vdm5kLmZ1bWluaXdhLmVudGl0eStqc29uO3ZlcnNpb249MiIsImVudGl0eUtleSI6ImNoYXJhY3Rlci8wMDAwMDAwMC0wMDAwLTQwMDAtODAwMC0wMDAwMDAwMDAxMDMiLCJvYmplY3RJZCI6ImUzMjUxYzdiZjk3YWM0MTAzYWM5YTY2Yjc4NzVkN2MzZmNlNjM2OTViOWQyODAyN2RhNmVjN2EzNjdhNjI5NDgifSx7ImJ5dGVDb3VudCI6MjcsImNvbnRlbnRUeXBlIjoiYXBwbGljYXRpb24vdm5kLmZ1bWluaXdhLmVudGl0eStqc29uO3ZlcnNpb249MiIsImVudGl0eUtleSI6ImVwaXNvZGUvMDAwMDAwMDAtMDAwMC00MDAwLTgwMDAtMDAwMDAwMDAwMTAyL2JvZHkiLCJvYmplY3RJZCI6ImNjMTBiODgzZDZiOWYyMzk2NTFkNzI4ZjlmNjU1YzM2NjcwMzViZTM2YjRlOGVmOTQwY2MzM2U0YThjYjZlYjcifSx7ImJ5dGVDb3VudCI6MTgsImNvbnRlbnRUeXBlIjoiYXBwbGljYXRpb24vdm5kLmZ1bWluaXdhLmVudGl0eStqc29uO3ZlcnNpb249MiIsImVudGl0eUtleSI6ImVwaXNvZGUvMDAwMDAwMDAtMDAwMC00MDAwLTgwMDAtMDAwMDAwMDAwMTAyL21lbW8iLCJvYmplY3RJZCI6ImZiNTBhYTNmYzUyZDQwN2QxZDQ2NGVjNjg0NmQ1ZjYzZTRkNGM1OTc4MzNlODFhODQzMmU3YzQ2Yzk1M2QzZTIifSx7ImJ5dGVDb3VudCI6MjcsImNvbnRlbnRUeXBlIjoiYXBwbGljYXRpb24vdm5kLmZ1bWluaXdhLmVudGl0eStqc29uO3ZlcnNpb249MiIsImVudGl0eUtleSI6ImVwaXNvZGUvMDAwMDAwMDAtMDAwMC00MDAwLTgwMDAtMDAwMDAwMDAwMTAyL3RpdGxlIiwib2JqZWN0SWQiOiIwODliNmMzYjEyYWZmYjlkNjNlZDQ2ZmMwNjQ0NzZkOTgwZjkzZTlmYzE1ZjAxNGY1YmUwZTA2ZTVjNmUxMWI1In0seyJieXRlQ291bnQiOjE4NiwiY29udGVudFR5cGUiOiJhcHBsaWNhdGlvbi92bmQuZnVtaW5pd2EuZW50aXR5K2pzb247dmVyc2lvbj0yIiwiZW50aXR5S2V5IjoiZmxhZy8wMDAwMDAwMC0wMDAwLTQwMDAtODAwMC0wMDAwMDAwMDAxMDUiLCJvYmplY3RJZCI6IjQwNDQ4MWRkYjMxZWJjYjE2OGYwZjUwNmEzNmRhYjhjYWIwZmVkNjVhMDcwZmZmYzE5NjIwMjE5OTg1Y2NmNGMifSx7ImJ5dGVDb3VudCI6MTMyLCJjb250ZW50VHlwZSI6ImFwcGxpY2F0aW9uL3ZuZC5mdW1pbml3YS5lbnRpdHkranNvbjt2ZXJzaW9uPTIiLCJlbnRpdHlLZXkiOiJwbG90LWNhcmQvMDAwMDAwMDAtMDAwMC00MDAwLTgwMDAtMDAwMDAwMDAwMTA0Iiwib2JqZWN0SWQiOiI2YWMzZjVhZmY3NTNlM2NmYTBiMDAzZjU3MmQyNzJjMWM1NjZkOGI3ZmY1Mjk4OTI5ODg3ZWFmZDVjNjNjNGUxIn0seyJieXRlQ291bnQiOjQ4LCJjb250ZW50VHlwZSI6ImFwcGxpY2F0aW9uL3ZuZC5mdW1pbml3YS5lbnRpdHkranNvbjt2ZXJzaW9uPTIiLCJlbnRpdHlLZXkiOiJ3b3JrL2F0dGFjaG1lbnQtb3JkZXIiLCJvYmplY3RJZCI6IjRkOTY0OGJjYWRiN2NhNzQ3MzBhMzExZjk1OTI4MzdkM2FhMjgwMmRkNWRjYjYwYjI1NGE1NjU3ZTkyZmU5MGQifSx7ImJ5dGVDb3VudCI6NDgsImNvbnRlbnRUeXBlIjoiYXBwbGljYXRpb24vdm5kLmZ1bWluaXdhLmVudGl0eStqc29uO3ZlcnNpb249MiIsImVudGl0eUtleSI6IndvcmsvY2hhcHRlci1vcmRlciIsIm9iamVjdElkIjoiMWVkZDI1NzU1YzkwN2E0Yjg2NDQ3ZDc0NDVhOWU0ZmNmNzFkYWNkOTZmM2VhMDI3ZDk1NWRlMTZmNjc3YmRmNyJ9LHsiYnl0ZUNvdW50Ijo0OCwiY29udGVudFR5cGUiOiJhcHBsaWNhdGlvbi92bmQuZnVtaW5pd2EuZW50aXR5K2pzb247dmVyc2lvbj0yIiwiZW50aXR5S2V5Ijoid29yay9jaGFyYWN0ZXItb3JkZXIiLCJvYmplY3RJZCI6IjFiMjQzOTVjMDFlY2JlY2VmNDcyNDcyNmJjNDE2MWExZjIwMWRjZGM5YWQwNDNmMTEyMmQxYThhYzM2NDNhMWMifSx7ImJ5dGVDb3VudCI6OTYsImNvbnRlbnRUeXBlIjoiYXBwbGljYXRpb24vdm5kLmZ1bWluaXdhLmVudGl0eStqc29uO3ZlcnNpb249MiIsImVudGl0eUtleSI6IndvcmsvZG9jdW1lbnQiLCJvYmplY3RJZCI6IjFhZGE0MDJjNjZjMjk4NjZmYjMxYzUyYWI3NmVjY2ZlMmM2MjRlYWVhOTRlN2E4ODA3NGQ5ZWJjMTkxZTFiNWQifSx7ImJ5dGVDb3VudCI6NDgsImNvbnRlbnRUeXBlIjoiYXBwbGljYXRpb24vdm5kLmZ1bWluaXdhLmVudGl0eStqc29uO3ZlcnNpb249MiIsImVudGl0eUtleSI6IndvcmsvZmxhZy1vcmRlciIsIm9iamVjdElkIjoiNGUyNjMxYmNjN2E1MDRkNjhkZGU3NTU5ZTNlODk5NTBkOWFiYWYxNjkwNTZkZjRlNjY0ZGI4M2RmOTFjODRkYiJ9LHsiYnl0ZUNvdW50Ijo0OCwiY29udGVudFR5cGUiOiJhcHBsaWNhdGlvbi92bmQuZnVtaW5pd2EuZW50aXR5K2pzb247dmVyc2lvbj0yIiwiZW50aXR5S2V5Ijoid29yay9wbG90LWNhcmQtb3JkZXIiLCJvYmplY3RJZCI6ImM2ODY1YWZkMDA2OTdiY2NhOWRjNjIxZmI0MGFjOTA1MTA4NmY3YjRkNDYxOTFjZTIyMzQwZTdmYTAyMjE1ZGYifSx7ImJ5dGVDb3VudCI6NDIsImNvbnRlbnRUeXBlIjoiYXBwbGljYXRpb24vdm5kLmZ1bWluaXdhLmVudGl0eStqc29uO3ZlcnNpb249MiIsImVudGl0eUtleSI6Indvcmsvc3lub3BzaXMiLCJvYmplY3RJZCI6IjFiNDgwODYzNDIyYjYyYmJlMzU0Yzk1MGRlYzhmMTMwYzJjYzg1MDcyY2I3OTdmMzkxYTQ4MDYyMjFmZGQzODEifSx7ImJ5dGVDb3VudCI6MjcsImNvbnRlbnRUeXBlIjoiYXBwbGljYXRpb24vdm5kLmZ1bWluaXdhLmVudGl0eStqc29uO3ZlcnNpb249MiIsImVudGl0eUtleSI6IndvcmsvdGl0bGUiLCJvYmplY3RJZCI6IjE2ZGM0NWNkYmYzMmQzMTU4YmNkNWUyYzUyZGRhZmVlOTkyMDA0ZmQ4YmRmYjVmNDQ5MDBlNjg0ODk2YTgxZjAifSx7ImJ5dGVDb3VudCI6NDgsImNvbnRlbnRUeXBlIjoiYXBwbGljYXRpb24vdm5kLmZ1bWluaXdhLmVudGl0eStqc29uO3ZlcnNpb249MiIsImVudGl0eUtleSI6Indvcmsvd29ybGQtbm90ZS1vcmRlciIsIm9iamVjdElkIjoiNGIzYTBlMmJkOGRlMjRlM2UwYTU4ZDI2YzQwMDI1ZWRjYTRmNjBkZjg0ZjI5Zjc3MzkyZGEyZmI3NTA1MGI5MCJ9LHsiYnl0ZUNvdW50Ijo5MCwiY29udGVudFR5cGUiOiJhcHBsaWNhdGlvbi92bmQuZnVtaW5pd2EuZW50aXR5K2pzb247dmVyc2lvbj0yIiwiZW50aXR5S2V5Ijoid29ybGQtbm90ZS8wMDAwMDAwMC0wMDAwLTQwMDAtODAwMC0wMDAwMDAwMDAxMDYiLCJvYmplY3RJZCI6IjM1YWM2YTViZjNlOWY4MTZhYmQ3N2MwZWJiMGY2Y2FjMTkyN2I3Njg1ZmRiYmQ0MzkwMGUxMDNiY2I3ODM4OTgifV0sInBhcmVudFNuYXBzaG90SWRzIjpbXSwic2NoZW1hVmVyc2lvbiI6Miwid29ya0lkIjoiMDAwMDAwMDAtMDAwMC00MDAwLTgwMDAtMDAwMDAwMDAwMDAyIn0","id":"2ddb769bb544bc76039775b92b8fef1b7048cdaf5b09f91a9552d8ab77974a3a","kind":"manifest"},{"bytesBase64URL":"eyJ2YWx1ZSI6Iuahg-WckuOBruiqk-OBhCJ9","id":"089b6c3b12affb9d63ed46fc064476d980f93e9fc15f014f5be0e06e5c6e11b5","kind":"object"},{"bytesBase64URL":"eyJ2YWx1ZSI6IuS4ieWbveW_l-OCguOBriJ9","id":"16dc45cdbf32d3158bcd5e2c52ddafee992004fd8bdfb5f44900e684896a81f0","kind":"object"},{"bytesBase64URL":"eyJkb2N1bWVudENyZWF0ZWRBdCI6IjIwMjYtMDgtMTZUMDA6MDA6MDBaIiwiZG9jdW1lbnRJZCI6IjAwMDAwMDAwLTAwMDAtNDAwMC04MDAwLTAwMDAwMDAwMDAwMyJ9","id":"1ada402c66c29866fb31c52ab76eccfe2c624eaea94e7a88074d9ebc191e1b5d","kind":"object"},{"bytesBase64URL":"eyJpZHMiOlsiMDAwMDAwMDAtMDAwMC00MDAwLTgwMDAtMDAwMDAwMDAwMTAzIl19","id":"1b24395c01ecbecef4724726bc4161a1f201dcdc9ad043f1122d1a8ac3643a1c","kind":"object"},{"bytesBase64URL":"eyJ2YWx1ZSI6Iua8ouacq-OCkuiInuWPsOOBq-OBl-OBn-Wwj-iqrCJ9","id":"1b480863422b62bbe354c950dec8f130c2cc85072cb797f391a4806221fdd381","kind":"object"},{"bytesBase64URL":"eyJpZHMiOlsiMDAwMDAwMDAtMDAwMC00MDAwLTgwMDAtMDAwMDAwMDAwMTAxIl19","id":"1edd25755c907a4b86447d7445a9e4fcf71dacd96f3ea027d955de16f677bdf7","kind":"object"},{"bytesBase64URL":"eyJjb250ZW50Ijoi5ryi5pyr44Gu5LiW55WMIiwiaWQiOiIwMDAwMDAwMC0wMDAwLTQwMDAtODAwMC0wMDAwMDAwMDAxMDYiLCJ0aXRsZSI6IuaZguS7oyJ9","id":"35ac6a5bf3e9f816abd77c0ebb0f6cac1927b7685fdbbd43900e103bcb783898","kind":"object"},{"bytesBase64URL":"eyJpZCI6IjAwMDAwMDAwLTAwMDAtNDAwMC04MDAwLTAwMDAwMDAwMDEwNSIsImlzUmVzb2x2ZWQiOmZhbHNlLCJub3RlIjoi5b6M44Gn5Zue5Y-OIiwicGxhbnRlZENoYXB0ZXJJZCI6IjAwMDAwMDAwLTAwMDAtNDAwMC04MDAwLTAwMDAwMDAwMDEwMSIsInJlc29sdmVkQ2hhcHRlcklkIjpudWxsLCJ0aXRsZSI6IuS8j-e3miJ9","id":"404481ddb31ebcb168f0f506a36dab8cab0fed65a070fffc19620219985ccf4c","kind":"object"},{"bytesBase64URL":"eyJpZHMiOlsiMDAwMDAwMDAtMDAwMC00MDAwLTgwMDAtMDAwMDAwMDAwMTA2Il19","id":"4b3a0e2bd8de24e3e0a58d26c40025edca4f60df84f29f77392da2fb75050b90","kind":"object"},{"bytesBase64URL":"eyJpZHMiOlsiMDAwMDAwMDAtMDAwMC00MDAwLTgwMDAtMDAwMDAwMDAwMTA3Il19","id":"4d9648bcadb7ca74730a311f9592837d3aa2802dd5dcb60b254a5657e92fe90d","kind":"object"},{"bytesBase64URL":"eyJpZHMiOlsiMDAwMDAwMDAtMDAwMC00MDAwLTgwMDAtMDAwMDAwMDAwMTA1Il19","id":"4e2631bcc7a504d68dde7559e3e89950d9abaf169056df4e664db83df91c84db","kind":"object"},{"bytesBase64URL":"bWFw","id":"60be9861750facbfad8758254a2f76c0cfe78d54459a3bc187d49b1401fcd8e8","kind":"object"},{"bytesBase64URL":"eyJjaGFwdGVySWQiOiIwMDAwMDAwMC0wMDAwLTQwMDAtODAwMC0wMDAwMDAwMDAxMDEiLCJpZCI6IjAwMDAwMDAwLTAwMDAtNDAwMC04MDAwLTAwMDAwMDAwMDEwNCIsIm1lbW8iOiLlh7rkvJrjgYQiLCJ0aXRsZSI6Iuahg-WckiJ9","id":"6ac3f5aff753e3cfa0b003f572d272c1c566d8b7ff5298929887eafd5c63c4e1","kind":"object"},{"bytesBase64URL":"eyJ2YWx1ZSI6IuesrOS4gOeroCJ9","id":"846de54f526906f43423feabd3cb7cb8564eb8818058f96e59c2981465e4fe20","kind":"object"},{"bytesBase64URL":"eyJpZHMiOlsiMDAwMDAwMDAtMDAwMC00MDAwLTgwMDAtMDAwMDAwMDAwMTAyIl19","id":"ac8f84b04b57e0ac63e128604bd068cc3f632bf3eb53ebdb6397521b9958c7c7","kind":"object"},{"bytesBase64URL":"eyJpZHMiOlsiMDAwMDAwMDAtMDAwMC00MDAwLTgwMDAtMDAwMDAwMDAwMTA0Il19","id":"c6865afd00697bcca9dc621fb40ac9051086f7b4d46191ce22340e7fa02215df","kind":"object"},{"bytesBase64URL":"eyJ2YWx1ZSI6IuacrOaWh-OBp-OBmeOAgiJ9","id":"cc10b883d6b9f239651d728f9f655c3667035be36b4e8ef940cc33e4a8cb6eb7","kind":"object"},{"bytesBase64URL":"eyJhZ2UiOm51bGwsImFwcGVhcmFuY2UiOm51bGwsImJhY2tncm91bmQiOm51bGwsImNvbG9ySGV4IjoiI0MwMzkyQiIsImZpcnN0UGVyc29uIjoi5L-6IiwiZ2VuZGVyIjpudWxsLCJpZCI6IjAwMDAwMDAwLTAwMDAtNDAwMC04MDAwLTAwMDAwMDAwMDEwMyIsImthbmEiOiLjgorjgoXjgYbjgbMiLCJtZW1vIjoi5Li75Lq65YWsIiwibmFtZSI6IuWKieWCmSIsInBlcnNvbmFsaXR5IjpudWxsLCJyb2xlIjoi5Li75b25Iiwic2Vjb25kUGVyc29uIjpudWxsLCJzcGVlY2hTdHlsZSI6bnVsbH0","id":"e3251c7bf97ac4103ac9a66b7875d7c3fce63695b9d28027da6ec7a367a62948","kind":"object"},{"bytesBase64URL":"eyJ2YWx1ZSI6IuWGkumgrSJ9","id":"fb50aa3fc52d407d1d464ec6846d5f63e4d4c597833e81a8432e7c46c953d3e2","kind":"object"},{"bytesBase64URL":"eyJhdHRhY2htZW50SWQiOiIwMDAwMDAwMC0wMDAwLTQwMDAtODAwMC0wMDAwMDAwMDAxMDciLCJieXRlQ291bnQiOjMsImZpbGVOYW1lIjoibWFwLnR4dCJ9","id":"fc6cf4063320fb64649855d0c981ca430812d75f890882be2dda562e864c7779","kind":"object"}],"nextCursor":null,"result":"noChanges","snapshotId":"2ddb769bb544bc76039775b92b8fef1b7048cdaf5b09f91a9552d8ab77974a3a"}