{"items":[{"bytesBase64URL":"eyJlbnRyaWVzIjpbeyJieXRlQ291bnQiOjE2LCJjb250ZW50VHlwZSI6ImFwcGxpY2F0aW9uL29jdGV0LXN0cmVhbSIsImVudGl0eUtleSI6ImF0dGFjaG1lbnQvMTA2MDAwMDAtMDAwMC00MDAwLTgwMDAtMDAwMDAwMDAwMDAwL2J5dGVzIiwib2JqZWN0SWQiOiJjYzhhZWY1ZGZhMWY4MTEwMTQ3ZDgzODcyYjAxYmM4Yzg1YWRlYjUwYjg5ZDg4ZjE5MDJjZjE4NjY1NTAxNmIxIn0seyJieXRlQ291bnQiOjE2LCJjb250ZW50VHlwZSI6ImFwcGxpY2F0aW9uL29jdGV0LXN0cmVhbSIsImVudGl0eUtleSI6ImF0dGFjaG1lbnQvMTA2MDAwMDAtMDAwMC00MDAwLTgwMDAtMDAwMDAwMDAwNTAwL2J5dGVzIiwib2JqZWN0SWQiOiI2OTA4NTJiMmEyODkxNGUxMGRkODE5YmVlZWQyNGIyZTc4MGNhZmViYTdmZjdhYTVkNGEzMmNmNWUzMDhlNzExIn0seyJieXRlQ291bnQiOjI2MjE0NSwiY29udGVudFR5cGUiOiJhcHBsaWNhdGlvbi9vY3RldC1zdHJlYW0iLCJlbnRpdHlLZXkiOiJhdHRhY2htZW50LzEwNjAwMDAwLTAwMDAtNDAwMC04MDAwLTAwMDAwMDAwMDYwMC9ieXRlcyIsIm9iamVjdElkIjoiMzNjZWYzY2QxZjYzN2FjYzUyNmFkNzIzYzJjNDM5NjQ0NmY1MjU0YmZjNmMyOTljNmNkZmJlZmIyNDgyODNkZiJ9XSwicGFyZW50U25hcHNob3RJZHMiOlsiZTUxOTIyMTY5YWE4YzAxOGVhMjM3ZjVmNzkzOTM5YmE0ZDM0MjE2YjVkM2MwMjBjOWIyNjE1MjE0NjA5ODIwZiIsImY4YmI1ZTRkZmM4NjY1OTAzYWRkMTY2NDZiMDY5NWY0NTI5OTYwODUyMzZjNjkzOWIwYmQwNGU0MDdkMDcxNzAiXSwic2NoZW1hVmVyc2lvbiI6Miwid29ya0lkIjoiMTA2MDAwMDAtMDAwMC00MDAwLTgwMDAtMDAwMDAwMDAwMDAxIn0","id":"eebfba31ee267d6259ddd0dd5a8c1215eed298ea8c04640637da438d5ef16b0d","kind":"manifest"},{"bytesBase64URL":"c2hhbGxvdy0wMDAwMDUwMA","id":"690852b2a28914e10dd819beeed24b2e780cafeba7ff7aa5d4a32cf5e308e711","kind":"object"},{"bytesBase64URL":"c2hhbGxvdy0wMDAwMDAwMA","id":"cc8aef5dfa1f8110147d83872b01bc8c85adeb50b89d88f1902cf186655016b1","kind":"object"}],"mode":"head","nextCursor":null,"result":"noChanges","snapshotId":"eebfba31ee267d6259ddd0dd5a8c1215eed298ea8c04640637da438d5ef16b0d","totals":{"bytes":263028,"items":4}}